{
  "schema_version": 2,
  "description": "Real limited topology: bootstrap, transport and analytical model checks",
  "files": {
    "required": {
      "geometry": "geometry.geo",
      "equilibrium_magnetic_field": "equilibrium.h5"
    },
    "optional": {
      "bootstrap_reference": "reference_bootstrap.h5",
      "bootstrap_mesh": "mesh_bootstrap.msh",
      "baseline_reference": "reference_baseline.h5",
      "transport_reference": "reference_transport.h5",
      "transport_short_reference": "reference_transport_short.h5",
      "transport_configuration": "transport_model.nml",
      "impurity_configuration": "impurity_model_w.nml",
      "coarse_mesh": "mesh_adaptive_initial.msh",
      "cold_fixed_time_init_parameters": "param_cold_fixed_time_init.txt"
    }
  },
  "workflows": {
    "bootstrap_adaptive": {
      "outputs": [
        "bootstrap_reference",
        "bootstrap_mesh"
      ]
    },
    "bootstrap_fixed": {},
    "baseline_warm": {},
    "transport": {},
    "transport_short": {},
    "cold_step_impurity_off": {
      "impurity_configuration": null,
      "extends": "cold_step_fixed",
      "description": "Exercise analytical initialization with impurity radiation disabled",
      "parameter_overrides": {
        "impurity_radiation": false
      }
    },
    "cold_step_neutralgamma": {
      "model": "NGammaTiTeNeutralGamma",
      "extends": "cold_step_impurity_off",
      "description": "Exercise NeutralGamma for one fixed cold step and two Newton iterations",
      "parameter_overrides": {
        "neutral_wall_sources_in_elements": false
      }
    },
    "newton_absolute": {},
    "newton_incremental": {}
  }
}
