{
  "schema_version": 2,
  "description": "Real diverted topology: routine baseline and independent physical features",
  "files": {
    "required": {
      "geometry": "geometry.geo",
      "equilibrium_magnetic_field": "equilibrium.h5"
    },
    "optional": {
      "bootstrap_reference": "reference_bootstrap.h5",
      "baseline_reference": "reference_baseline.h5",
      "transport_reference": "reference_transport.h5",
      "transport_short_reference": "reference_transport_short.h5",
      "stored_field_reference": "reference_stored_field.h5",
      "source_reference": "reference_source.h5",
      "neutral_pressure_reference": "reference_neutral_pressure.h5",
      "neutral_perpendicular_reference": "reference_neutral_perpendicular.h5",
      "neutral_limiter_fixed_reference": "reference_neutral_limiter_fixed.h5",
      "neutral_limiter_ti_reference": "reference_neutral_limiter_ti.h5",
      "neutral_wall_absorption_reference": "reference_neutral_wall_absorption.h5",
      "neutral_wall_absorption_pump_reference": "reference_neutral_wall_absorption_pump.h5",
      "neutral_pressure_short_reference": "reference_neutral_pressure_short.h5",
      "neutral_perpendicular_short_reference": "reference_neutral_perpendicular_short.h5",
      "neutral_limiter_fixed_short_reference": "reference_neutral_limiter_fixed_short.h5",
      "neutral_limiter_ti_short_reference": "reference_neutral_limiter_ti_short.h5",
      "impurity_off_reference": "reference_impurity_off.h5",
      "impurity_n_reference": "reference_impurity_n.h5",
      "impurity_nw_reference": "reference_impurity_nw.h5",
      "impurity_off_short_reference": "reference_impurity_off_short.h5",
      "impurity_n_short_reference": "reference_impurity_n_short.h5",
      "impurity_nw_short_reference": "reference_impurity_nw_short.h5",
      "adaptive_source_short_reference": "reference_adaptive_source_short.h5",
      "impurity_n_configuration": "impurity_model_n.nml",
      "impurity_nw_configuration": "impurity_model_nw.nml",
      "transport_configuration": "transport_model.nml",
      "impurity_configuration": "impurity_model_w.nml",
      "coarse_mesh": "mesh_adaptive_initial.msh",
      "cold_fixed_time_init_parameters": "param_cold_fixed_time_init.txt"
    }
  },
  "workflows": {
    "bootstrap_adaptive": {
      "parameter_overrides": {"tol_est": 0.02}
    },
    "baseline_warm": {},
    "transport": {},
    "transport_short": {},
    "stored_field": {},
    "source_relocation": {},
    "neutral_pressure": {},
    "neutral_perpendicular": {},
    "neutral_limiter_fixed": {},
    "neutral_limiter_ti": {},
    "neutral_wall_absorption": {},
    "neutral_wall_absorption_pump": {},
    "neutral_pressure_short": {},
    "neutral_perpendicular_short": {},
    "neutral_limiter_fixed_short": {},
    "neutral_limiter_ti_short": {},
    "impurity_off": {},
    "impurity_n": {},
    "impurity_nw": {},
    "impurity_off_short": {},
    "impurity_n_short": {},
    "impurity_nw_short": {},
    "adaptive_source_short": {
      "parameter_overrides": {"tol_est": 0.02}
    }
  }
}
